{
  "bomFormat": "CycloneDX",
  "specVersion": "1.6",
  "version": 1,
  "metadata": {
    "timestamp": "2026-04-17T00:00:00Z"
  },
  "components": [
    {
      "bom-ref": "pkg:npm/example@1.0.0",
      "type": "library",
      "name": "example",
      "version": "1.0.0",
      "purl": "pkg:npm/example@1.0.0"
    }
  ]
}
